{
  "slug": "2026-08-23-unsloth-lan-remote",
  "topic": "Unsloth v0.1.801-beta lets you reach Unsloth Desktop from another device on your own network",
  "generated_at": "2026-08-23T13:10:00Z",
  "depth": "standard",
  "thesis": "Unsloth can now be reached from any device in your house without a Cloudflare tunnel, which is three settings and one password, and the same switch also lets anyone on your network run code as you.",
  "explanation_path": "Start where the viewer already is: the model runs on the box in the other room and they are on the couch. Establish that Unsloth binds to loopback by default, so it is deliberately unreachable. Then the change: a wildcard bind exposes it to the network, either from Settings or with a flag. Then the password gate, which is not optional. Close on the risk the release notes do not lead with: server-side tools run as your user, so network reach is code execution reach.",
  "viewer_situation": "Your model runs on the box in the other room and you are on the couch with a laptop or a phone.",
  "has_process": true,
  "process_steps": [
    "Open Settings, API keys, LAN access, or launch with `unsloth studio -H 0.0.0.0`",
    "Change the auto-generated bootstrap admin password when Unsloth stops and asks",
    "Connect from the other device using the shown address or QR code",
    "Pass `--disable-tools` if you do not want server-side tools reachable"
  ],
  "objection": "Unsloth already documents a Cloudflare tunnel, so why bother with a LAN bind?",
  "claims": [
    {
      "claim": "Unsloth v0.1.801-beta shipped on 2026-08-20 with LAN Remote Access in preview and auto compaction, merging more than 200 pull requests.",
      "source_url": "https://github.com/unslothai/unsloth/releases/tag/v0.1.801-beta",
      "source_title": "unsloth v0.1.801-beta release notes",
      "source_quality": "primary",
      "confidence": "high",
      "accessed": "2026-08-23"
    },
    {
      "claim": "LAN access is disabled by default and requires changing the generated admin password, and can be toggled without restarting from a dedicated Settings section that also shows connection addresses and QR codes.",
      "source_url": "https://github.com/unslothai/unsloth/releases/tag/v0.1.801-beta",
      "source_title": "unsloth v0.1.801-beta release notes",
      "source_quality": "primary",
      "confidence": "high",
      "accessed": "2026-08-23"
    },
    {
      "claim": "Unsloth binds to 127.0.0.1 by default, which the docs describe as 'this machine only'; `unsloth studio -H 0.0.0.0` makes the raw port reachable on 'your network'.",
      "source_url": "https://unsloth.ai/docs/basics/how-to-serve-local-llms-anywhere-secure-remote-access-with-cloudflare-and-unsloth",
      "source_title": "Unsloth docs: secure remote access",
      "source_quality": "docs",
      "confidence": "high",
      "accessed": "2026-08-23"
    },
    {
      "claim": "The default port is 8888, and `--secure` publishes only through Cloudflare while keeping the raw port on loopback.",
      "source_url": "https://unsloth.ai/docs/basics/how-to-serve-local-llms-anywhere-secure-remote-access-with-cloudflare-and-unsloth",
      "source_title": "Unsloth docs: secure remote access",
      "source_quality": "docs",
      "confidence": "high",
      "accessed": "2026-08-23"
    },
    {
      "claim": "Unsloth's own banner warns that 'Server-side tools run as your user' and that 'anyone reaching the server with your API key can run code on that machine', recommending `--disable-tools` when exposing it.",
      "source_url": "https://unsloth.ai/docs/basics/how-to-serve-local-llms-anywhere-secure-remote-access-with-cloudflare-and-unsloth",
      "source_title": "Unsloth docs: secure remote access",
      "source_quality": "docs",
      "confidence": "high",
      "accessed": "2026-08-23"
    },
    {
      "claim": "The feature was asked for because users did not want to route their own rig through a third party: 'I don't have internet access or I don't want to pipe everything though a Cloudflare temp URL just to access my local AI rig remotely.'",
      "source_url": "https://github.com/unslothai/unsloth/issues/9207",
      "source_title": "unsloth issue 9207: allow remote access without Cloudflare",
      "source_quality": "community",
      "confidence": "high",
      "accessed": "2026-08-23"
    },
    {
      "claim": "Auto compaction keeps long chats going past the context limit by evicting whole oldest turns into a searchable per-thread archive, and deliberately does not summarize because summarization 'showed little benefit and added ~190s per compaction'.",
      "source_url": "https://github.com/unslothai/unsloth/releases/tag/v0.1.801-beta",
      "source_title": "unsloth v0.1.801-beta release notes",
      "source_quality": "primary",
      "confidence": "high",
      "accessed": "2026-08-23"
    }
  ],
  "key_numbers": [
    {
      "label": "Default bind address",
      "value": "127.0.0.1",
      "source_url": "https://unsloth.ai/docs/basics/how-to-serve-local-llms-anywhere-secure-remote-access-with-cloudflare-and-unsloth"
    },
    {
      "label": "Default port",
      "value": "8888",
      "source_url": "https://unsloth.ai/docs/basics/how-to-serve-local-llms-anywhere-secure-remote-access-with-cloudflare-and-unsloth"
    },
    {
      "label": "Time summarization added per compaction, which is why it was dropped",
      "value": "~190s",
      "source_url": "https://github.com/unslothai/unsloth/releases/tag/v0.1.801-beta"
    },
    {
      "label": "Pull requests merged in the release",
      "value": "200+",
      "source_url": "https://github.com/unslothai/unsloth/releases/tag/v0.1.801-beta"
    },
    {
      "label": "Accuracy gain claimed for Qwen3.8-27B Dynamic v3.0 GGUFs",
      "value": ">10% higher top-1 accuracy",
      "source_url": "https://github.com/unslothai/unsloth/releases/tag/v0.1.801-beta"
    }
  ],
  "analogy_candidates": [
    {
      "vehicle": "a door that only opens from the inside, until you fit it with a handle on the outside",
      "mapping": "loopback is the inside-only door; the wildcard bind fits the outside handle; the admin password is the lock you are forced to change before the handle works",
      "limit": "a real door does not let a visitor run your errands, and this one does: server-side tools execute as your user"
    }
  ],
  "misconceptions": [
    {
      "myth": "Reaching your own machine from your own network needs a tunnel through someone else's service.",
      "reality": "Cloudflare publishes a public URL, which is useful outside the house. Inside it, a wildcard bind reaches the same server with nothing in the path."
    },
    {
      "myth": "Turning on LAN access is just a convenience toggle.",
      "reality": "It is an execution boundary. Unsloth's own docs say anyone reaching the server with your API key can run code on that machine, which is why the password change is forced and `--disable-tools` exists."
    }
  ],
  "glossary": [
    {
      "term": "loopback",
      "definition": "the address a machine uses to talk to itself, so nothing outside it can connect"
    },
    {
      "term": "wildcard bind",
      "definition": "listening on every network address the machine has, instead of only its own"
    },
    {
      "term": "tunnel",
      "definition": "a relay that gives your local server a public web address by routing traffic through an outside service"
    },
    {
      "term": "compaction",
      "definition": "dropping the oldest turns of a chat once it outgrows the model's context window"
    }
  ],
  "unverified": [
    "Issue 9207 still reads as open and unresolved with no maintainer response, while the release notes describe the feature as shipped in preview. One of the two is stale; do not claim the issue was closed by this release.",
    "The release notes do not state a port or URL for the Settings path; the port 8888 figure comes from the CLI docs and may differ in the desktop app.",
    "No independent test of the LAN path was run for this brief."
  ],
  "suggested_outline": "1. You are on the couch and the model is in the other room, and Unsloth will not answer. 2. It binds to itself on purpose: one setting, or one flag, changes that, and it stops to make you set a real password. 3. The catch the release notes bury: anyone who reaches it with your key runs code as you, so disable tools unless you meant it.",
  "notes": "Format is smooth-explainer, so at most three spoken numbers. The strongest are the default port, the forced password, and the ~190s summarization figure, but the security line matters more than any of them."
}
